,name,skills,ratings,level
517,Prepare for DP-203: Data Engineering on Microsoft Azure Exam, Microsoft Azure,4.4,Intermediate · Course · 1 - 4 Weeks
518,Cervical Cancer Risk Prediction Using Machine Learning," Machine Learning, Data Analysis",4.7,Beginner · Guided Project · Less Than 2 Hours
519,3D SARS-CoV-19 Protein Visualization With Biopython," Bioinformatics, Python Programming",4.5,Intermediate · Guided Project · Less Than 2 Hours
520,"Reverse and complement nucleic acid sequences (DNA, RNA) using R"," R Programming, Computer Programming",4.4,Beginner · Guided Project · Less Than 2 Hours
521,Data Visualization with Power BI: Storytelling with Data," Data Analysis, Data Visualization, Power BI",4.4,Intermediate · Guided Project · Less Than 2 Hours
522,"Statistics and Data Analysis with Excel, Part 2", Microsoft Excel,Not Available,Intermediate · Course · 1 - 3 Months
523,Moneyball and Beyond," Data Analysis, Statistical Analysis, Python Programming, General Statistics, Probability & Statistics, Basic Descriptive Statistics, Statistical Programming, Exploratory Data Analysis, Regression, Statistical Tests",4.6,Intermediate · Course · 1 - 3 Months
524,SARS-CoV-2 Protein Modeling and Drug Docking, Bioinformatics,4.7,Intermediate · Guided Project · Less Than 2 Hours
525,Data Science for Health Research,Not Available,Not Available,Intermediate · Specialization · 1 - 3 Months
526,Big Data Integration and Processing," Big Data, Data Management, Databases, Data Analysis, SQL, Apache, Data Analysis Software, Data Structures, Exploratory Data Analysis, PostgreSQL",4.4,Beginner · Course · 1 - 3 Months
527,Introduction to Data Science and scikit-learn in Python," Python Programming, Data Science, Machine Learning, Regression",3.8,Beginner · Course · 1 - 4 Weeks
528,Data Engineering with MS Azure Synapse Apache Spark Pools," Big Data, Cloud Computing, Cloud Engineering, Data Management, Data Structures, Extract, Transform, Load, Microsoft Azure, Cloud Storage, Data Warehousing, Distributed Computing Architecture, SQL",3.7,Intermediate · Course · 1 - 4 Weeks
529,Text Retrieval and Search Engines," Machine Learning, Natural Language Processing",4.5,Mixed · Course · 1 - 3 Months
530,Linear Regression for Business Statistics," General Statistics, Probability & Statistics, Regression",4.8,Mixed · Course · 1 - 4 Weeks
531,Operational Analytics with Microsoft Azure Synapse Analytics," Big Data, Data Management, Databases, Extract, Transform, Load, Operational Analysis, SQL, Cloud Storage, Cloud-Based Integration, Data Analysis, Data Warehousing, Microsoft Azure",4.5,Intermediate · Course · 1 - 4 Weeks
532,Applied Data Science for Data Analysts," Machine Learning, Machine Learning Algorithms, Algorithms, Human Learning, Python Programming, Applied Machine Learning, Regression, Data Analysis, Feature Engineering, Statistical Programming, Data Science",4.5,Intermediate · Course · 1 - 3 Months
533,Data Processing and Feature Engineering with MATLAB," Data Analysis, Exploratory Data Analysis, Matlab, Data Visualization, Probability & Statistics, Statistical Analysis, Correlation And Dependence, Feature Engineering, Plot (Graphics), Statistical Visualization",4.7,Intermediate · Course · 1 - 3 Months
534,Statistical Analysis Fundamentals using Excel," Basic Descriptive Statistics, Data Analysis, Data Visualization, General Statistics, Probability & Statistics, Python Programming, Statistical Analysis, Statistical Tests, Mathematical Theory & Analysis, Probability Distribution, Forecasting, Microsoft Excel",Not Available,Intermediate · Course · 1 - 3 Months
535,Databricks to Local LLMs," Data Science, Machine Learning",Not Available,Beginner · Course · 1 - 4 Weeks
536,Total Data Quality, Data Analysis,4.5,Beginner · Specialization · 1 - 3 Months
537,Machine Learning for Computer Vision," Computer Vision, Machine Learning",4.9,Intermediate · Course · 1 - 4 Weeks
538,Using Advanced Formulas and Functions in Excel,Not Available,3.3,Intermediate · Guided Project · Less Than 2 Hours
539,Demand Planning in RStudio: Create Demand Forecast," Data Analysis, Forecasting",Not Available,Intermediate · Guided Project · Less Than 2 Hours
540,Computational Social Science Methods," Big Data, Data Analysis, Computational Thinking, Human Learning, Machine Learning, Applied Machine Learning, Computer Programming, Data Model, Machine Learning Algorithms, Statistical Machine Learning",4.7,Beginner · Course · 1 - 4 Weeks
541,Intro to Time Series Analysis in R, Forecasting,4.4,Beginner · Guided Project · Less Than 2 Hours
542,"Intro to Analytic Thinking, Data Science, and Data Mining"," Business Analysis, Business Intelligence, Data Analysis, Data Mining, Exploratory Data Analysis",4.2,Intermediate · Course · 1 - 4 Weeks
543,Image Compression and Generation using Variational Autoencoders in Python, Machine Learning,4.7,Intermediate · Guided Project · Less Than 2 Hours
544,Bank Loan Approval Prediction With Artificial Neural Nets," Artificial Neural Networks, Deep Learning, Machine Learning, Python Programming",4.6,Beginner · Guided Project · Less Than 2 Hours
545,Data Balancing with Gen AI: Credit Card Fraud Detection, Python Programming,Not Available,Intermediate · Guided Project · Less Than 2 Hours
546,Data Analysis with OpenAI API: Save time with GenAI, Python Programming,Not Available,Intermediate · Guided Project · Less Than 2 Hours
547,Github CoPilot for Beginners: Write Software With AI," Machine Learning, Software Engineering, Web Development Tools",4.5,Intermediate · Guided Project · Less Than 2 Hours
548,Linear Regression with Python," Machine Learning, Python Programming, Regression, Data Science, Deep Learning",4.6,Intermediate · Guided Project · Less Than 2 Hours
549,Machine Learning for Telecom Customers Churn Prediction," Algorithms, Machine Learning, Computer Programming, Python Programming",4.7,Beginner · Guided Project · Less Than 2 Hours
550,Visualization for Data Journalism," Data Visualization, Communication, Journalism, Plot (Graphics), Statistical Visualization, Data Analysis, Python Programming",4.5,Beginner · Course · 1 - 3 Months
551,Interactive Machine Learning Dashboards using Plotly Dash," Machine Learning, Dimensionality Reduction",4.4,Intermediate · Guided Project · Less Than 2 Hours
552,AI Workflow: Business Priorities and Data Ingestion," Business Process Management, Data Management, Data Structures, Statistical Programming, Strategy and Operations, Python Programming, Data Science, Machine Learning",4.3,Intermediate · Course · 1 - 4 Weeks
553,AI Workflow: Feature Engineering and Bias Detection," Algorithms, Dimensionality Reduction, Feature Engineering, Machine Learning, Data Science, Python Programming",4.4,Advanced · Course · 1 - 4 Weeks
554,AI Workflow: Data Analysis and Hypothesis Testing," Data Analysis, Data Visualization, Data Science, Machine Learning, Python Programming",4.2,Advanced · Course · 1 - 4 Weeks
555,Geospatial Data Visualization using Python and Folium," Data Visualization, Python Programming",5.0,Intermediate · Guided Project · Less Than 2 Hours
556,Using Shiny to Plot Differential Gene Expression, Data Visualization,4.4,Beginner · Guided Project · Less Than 2 Hours
557,Statistics For Data Science," General Statistics, Statistical Analysis, Basic Descriptive Statistics",4.0,Beginner · Guided Project · Less Than 2 Hours
558,Diabetes Prediction With Pyspark MLLIB," Machine Learning, Python Programming, Data Science",4.6,Intermediate · Guided Project · Less Than 2 Hours
559,New Ways of Working in an AI World,Not Available,Not Available,Intermediate · Course · 1 - 3 Months
560,Data Visualization with ChatGPT: Python for Dashboarding," Data Analysis, Python Programming",Not Available,Intermediate · Guided Project · Less Than 2 Hours
561,Natural Language Processing on Google Cloud," Machine Learning, Natural Language Processing, Tensorflow",4.4,Advanced · Course · 1 - 3 Months
562,Breast Cancer Prediction Using Machine Learning," Machine Learning, Regression, Data Mining, Python Programming",4.5,Intermediate · Guided Project · Less Than 2 Hours
563,GenAI Summarization with Langchain: Summarize Text Documents," Python Programming, Web Development",Not Available,Intermediate · Guided Project · Less Than 2 Hours
564,Machine Learning - Anomaly Detection via PyCaret," Machine Learning, Data Visualization",3.8,Intermediate · Guided Project · Less Than 2 Hours
565,Perplexity.AI for Beginners: AI-Powered Search,Not Available,Not Available,Beginner · Guided Project · Less Than 2 Hours
566,Data Engineering in AWS, Machine Learning,3.3,Beginner · Course · 1 - 4 Weeks
567,Data Visualization with Python," Business Communication, Cloud Applications, Data Analysis, Data Visualization, Python Programming",4.0,Intermediate · Course · 1 - 4 Weeks
568,Azure Data Lake Storage Gen2 and Data Streaming Solution," Cloud Engineering, Data Management, Big Data, Cloud Computing, Cloud Storage, Cloud-Based Integration, Extract, Transform, Load, Cloud Applications, Cloud Platforms, Data Analysis, Microsoft Azure",4.2,Intermediate · Course · 1 - 4 Weeks
569,Advanced Linear Models for Data Science 1: Least Squares," General Statistics, Probability & Statistics, Linear Algebra, Mathematics, Regression, Algebra, Correlation And Dependence",4.5,Advanced · Course · 1 - 3 Months
570,Artificial Intelligence Privacy and Convenience," Machine Learning, Applied Machine Learning, Data Analysis, Data Management, Data Model, Machine Learning Algorithms, Security Engineering, System Security",4.7,Intermediate · Course · 1 - 4 Weeks
571,"Statistics and Data Analysis with Excel, Part 1", Microsoft Excel,5.0,Beginner · Course · 1 - 3 Months
572,Introduction to Python Fundamentals," Computer Programming, Python Programming, Programming Principles, Computer Programming Tools, Computational Thinking, Problem Solving, Data Science",4.8,Beginner · Course · 1 - 4 Weeks
573,"Managing, Describing, and Analyzing Data", General Statistics,4.6,Beginner · Course · 1 - 3 Months
574,Learn Embeddings and Vector Databases,Not Available,5.0,Intermediate · Course · 1 - 4 Weeks
575,ML Pipelines on Google Cloud," Google Cloud Platform, Machine Learning, Applied Machine Learning, DevOps, Cloud Computing, Tensorflow, Cloud Platforms, Cloud-Based Integration, Continuous Integration, Training",3.4,Advanced · Course · 1 - 3 Months
576,Bayesian Statistics," Bayesian Statistics, General Statistics, Probability & Statistics, Statistical Analysis, Probability Distribution, Bayesian Network, R Programming, Statistical Programming, Statistical Tests",3.8,Intermediate · Course · 1 - 3 Months
577,"Basic Data Descriptors, Statistical Distributions, and Application to Business Decisions"," Probability & Statistics, Statistical Analysis, Basic Descriptive Statistics, Business Analysis, Business Intelligence, Spreadsheet Software, Microsoft Excel, Probability Distribution, General Statistics",4.7,Mixed · Course · 1 - 4 Weeks
578,Customising your models with TensorFlow 2," Deep Learning, Machine Learning, Artificial Neural Networks, Applied Machine Learning, Python Programming, Tensorflow",4.8,Intermediate · Course · 1 - 3 Months
579,Data Analysis and Reporting in SAS Visual Analytics," Data Analysis, Data Analysis Software, Data Management, Data Visualization, Data Visualization Software, Interactive Data Visualization, SAS (Software), Statistical Analysis, Statistical Programming, Statistical Visualization",4.8,Mixed · Course · 1 - 4 Weeks
580,Setting a Generative AI Strategy,Not Available,5.0,Beginner · Course · 1 - 4 Weeks
581,Empowering and Transforming Your Organization with GenAI,Not Available,Not Available,Beginner · Course · 1 - 4 Weeks
582,Navigating Generative AI Risks for Leaders,Not Available,5.0,Beginner · Course · 1 - 4 Weeks
583,Applied Social Network Analysis in Python," Graph Theory, Network Analysis, Python Programming, Computer Programming, Data Analysis, Network Model, Computer Networking, Network Architecture, Data Analysis Software, Visualization (Computer Graphics)",4.6,Intermediate · Course · 1 - 4 Weeks
584,Advanced Deep Learning Methods for Healthcare,Not Available,2.5,Advanced · Course · 1 - 4 Weeks
585,Reproducible Research," Communication, Computer Programming, Computer Programming Tools, Data Analysis, Exploratory Data Analysis, Knitr, Process Analysis, Programming Principles, R Programming, Statistical Analysis, Statistical Programming",4.6,Mixed · Course · 1 - 4 Weeks
586,Storytelling With Data," Critical Thinking, Storytelling, Microsoft Excel",4.5,Beginner · Guided Project · Less Than 2 Hours
587,Population Health: Predictive Analytics, R Programming,4.6,Intermediate · Course · 1 - 3 Months
588,Wearable Technologies and Sports Analytics," Data Analysis, Statistical Analysis, General Statistics, Python Programming",4.5,Intermediate · Course · 1 - 3 Months
589,Business Analytics for Decision Making," Business Analysis, Data Analysis, Decision Making, Data Management, Data Analysis Software, Exploratory Data Analysis, Mathematics, Statistical Analysis, Mathematical Theory & Analysis, Probability & Statistics",4.6,Beginner · Course · 1 - 4 Weeks
590,Mastering Data Analysis with Pandas," Computer Programming, Data Analysis, Python Programming",4.6,Beginner · Guided Project · Less Than 2 Hours
591,Deep Learning with PyTorch : Build an AutoEncoder," Deep Learning, Python Programming",4.1,Beginner · Guided Project · Less Than 2 Hours
592,Explore stock prices with Spark SQL," Apache, Big Data, Data Analysis, SQL",4.5,Intermediate · Guided Project · Less Than 2 Hours
593,Deploy Models with TensorFlow Serving and Flask," Deep Learning, Machine Learning, Docker (Software), Tensorflow",4.5,Intermediate · Guided Project · Less Than 2 Hours
594,Pandas Python Library for Beginners in Data Science," Computer Programming, Data Analysis, Data Science, Python Programming",4.4,Beginner · Guided Project · Less Than 2 Hours
595,English/French Translator: Long Short Term Memory Networks," Deep Learning, Machine Learning, Natural Language Processing, Python Programming",4.7,Beginner · Guided Project · Less Than 2 Hours
596,Data Visualization with OpenAI API: Generate code with GenAI," Data Analysis, Data Visualization, Python Programming",Not Available,Intermediate · Guided Project · Less Than 2 Hours
597,Create Technical Stock Charts Using R and Quantmod,Not Available,4.5,Beginner · Guided Project · Less Than 2 Hours
598,Introduction to R: Basic R syntax, R Programming,4.5,Beginner · Guided Project · Less Than 2 Hours
599,Descriptive and Inferential Statistics in R, R Programming,4.4,Intermediate · Guided Project · Less Than 2 Hours
600,Linear Regression with NumPy and Python," Machine Learning, Python Programming, Regression, Data Science",4.5,Intermediate · Guided Project · Less Than 2 Hours
601,Multiple Linear Regression with scikit-learn," Machine Learning, Python Programming, Regression, Data Visualization",4.5,Beginner · Guided Project · Less Than 2 Hours
602,Building Recommendation System Using MXNET on AWS Sagemaker," Deep Learning, Python Programming",3.3,Advanced · Guided Project · Less Than 2 Hours
603,Fake News Detection with Machine Learning," Machine Learning, Natural Language Processing, Python Programming",4.6,Beginner · Guided Project · Less Than 2 Hours
604,University Admission Prediction Using Multiple Linear Regression," Machine Learning, Regression, Deep Learning, Python Programming",4.6,Intermediate · Guided Project · Less Than 2 Hours
605,Generate Synthetic Images with DCGANs in Keras," Computer Vision, Deep Learning, Machine Learning, Tensorflow",4.5,Advanced · Guided Project · Less Than 2 Hours
606,Introduction to Systems and Network Mapping with Kumu," Network Analysis, Storytelling",4.6,Beginner · Guided Project · Less Than 2 Hours
607,AWS: Data Collection Systems," Cloud Computing, Data Analysis",4.8,Beginner · Course · 1 - 4 Weeks
608,LangChain: Application Development Essentials,Not Available,Not Available,Beginner · Course · 1 - 4 Weeks
609,Introduction to Data Visualization in Qlik Sense, Data Visualization,Not Available,Beginner · Course · 1 - 4 Weeks
610,Build a Data Warehouse Using BigQuery," Python Programming, SQL",Not Available,Advanced · Course · 1 - 4 Weeks
611,Python for Beginners: Variables and Strings," Computer Programming, Data Analysis, Data Visualization, Python Programming",4.6,Beginner · Guided Project · Less Than 2 Hours
612,Neural Network from Scratch in TensorFlow," Artificial Neural Networks, Deep Learning, Machine Learning, Data Science, Tensorflow",4.5,Intermediate · Guided Project · Less Than 2 Hours
613,Next-Generation AI Assistant: Claude by Anthropic,Not Available,Not Available,Beginner · Course · 1 - 4 Weeks
614,Machine Teaching for Autonomous AI," Human Learning, Critical Thinking, Machine Learning, Reinforcement Learning, Innovation",4.8,Beginner · Course · 1 - 4 Weeks
615,Introduction to Clinical Data Science," Clinical Data Management, Data Analysis, Data Management, Data Analysis Software, Databases, Leadership and Management, SQL, R Programming",4.5,Intermediate · Course · 1 - 4 Weeks
616,Data Visualization using dplyr and ggplot2 in R," Data Visualization, R Programming",4.9,Intermediate · Guided Project · Less Than 2 Hours
617,Clinical Data Models and Data Quality Assessments," Data Management, Data Model, Clinical Data Management, Databases, Extract, Transform, Load, Data Structures",4.2,Intermediate · Course · 1 - 3 Months
618,Analysing Covid-19 Geospatial data with Python, Python Programming,3.9,Intermediate · Guided Project · Less Than 2 Hours
619,Scripting with Python and SQL for Data Engineering," Data Management, Databases, Python Programming, Computer Programming, Programming Principles, SQL, Data Structures, Computer Programming Tools, Database Application, Extract, Transform, Load",4.4,Intermediate · Course · 1 - 4 Weeks
620,Design and Build a Data Warehouse for Business Intelligence Implementation," Data Warehousing, Business Intelligence, SQL",4.6,Mixed · Course · 1 - 3 Months
621,Communicating Business Analytics Results," Business Analysis, Business Communication, Communication, Data Analysis, Data Visualization, Statistical Visualization, Data Management, Exploratory Data Analysis, Plot (Graphics), Statistical Analysis",4.5,Intermediate · Course · 1 - 4 Weeks
622,Advanced Business Analytics Capstone, Data Analysis,4.3,Intermediate · Course · 1 - 4 Weeks
623,Advanced Linear Models for Data Science 2: Statistical Linear Models," General Statistics, Probability & Statistics, Linear Algebra, Mathematics, Algebra, Regression",4.5,Advanced · Course · 1 - 4 Weeks
624,"AI Workflow: Machine Learning, Visual Recognition and NLP"," Machine Learning, Natural Language Processing, Artificial Neural Networks, Data Science, Python Programming",4.5,Advanced · Course · 1 - 4 Weeks
625,Structured Approach to Problem Solving," Critical Thinking, Problem Solving",4.8,Beginner · Course · 1 - 4 Weeks
626,COVID19 Data Visualization Using Python," Data Analysis, Data Visualization, Python Programming",4.4,Intermediate · Guided Project · Less Than 2 Hours
627,Introduction to Machine Learning: Supervised Learning," Machine Learning, Statistical Machine Learning, Machine Learning Algorithms, Python Programming, Probability & Statistics, Statistical Programming, Regression, Data Analysis, Applied Machine Learning, Correlation And Dependence",3.4,Intermediate · Course · 1 - 3 Months
628,Supervised Text Classification for Marketing Analytics,Not Available,3.4,Beginner · Course · 1 - 4 Weeks
629,ANOVA and Experimental Design," General Statistics, Probability & Statistics, Experiment, Statistical Tests, Calculus, Linear Algebra",3.9,Intermediate · Course · 1 - 4 Weeks
630,Advanced SAS Programming Techniques, Statistical Programming,4.8,Intermediate · Course · 1 - 3 Months
631,Exploratory Data Analysis with MATLAB," Data Analysis, Data Analysis Software, Data Visualization, Data Visualization Software, Exploratory Data Analysis, Interactive Data Visualization, Matlab, Statistical Visualization, Data Structures, Plot (Graphics)",4.8,Beginner · Course · 1 - 3 Months
632,Regression Models," Correlation And Dependence, General Statistics, Probability & Statistics, R Programming, Regression, Statistical Analysis, Statistical Programming, Data Analysis, Data Model, Problem Solving",4.4,Mixed · Course · 1 - 4 Weeks
633,Fundamentals of Machine Learning for Supply Chain," Machine Learning, Python Programming, Data Science",3.9,Beginner · Course · 1 - 4 Weeks
634,Introduction to Predictive Modeling," Data Analysis, Forecasting, General Statistics, Regression, Spreadsheet Software, Statistical Analysis, Microsoft Excel, Probability & Statistics, Basic Descriptive Statistics, Plot (Graphics)",4.8,Mixed · Course · 1 - 4 Weeks
635,Advanced Data Visualization with R," Computer Programming, Data Visualization",4.9,Mixed · Course · 1 - 4 Weeks
636,Advanced AI Techniques for the Supply Chain," Machine Learning, Natural Language Processing",3.4,Intermediate · Course · 1 - 4 Weeks
637,Demand Forecasting Using Time Series," Machine Learning, Python Programming",3.3,Intermediate · Course · 1 - 4 Weeks
638,Machine Learning Models in Science," Machine Learning, Python Programming",3.8,Intermediate · Course · 1 - 4 Weeks
639,"Data – What It Is, What We Can Do With It"," Data Analysis, General Statistics, Basic Descriptive Statistics, Data Visualization, Exploratory Data Analysis, Probability & Statistics, Research and Design, Statistical Analysis, Statistical Tests",4.6,Beginner · Course · 1 - 4 Weeks
640,Data Storytelling,Not Available,3.7,Mixed · Course · 1 - 4 Weeks
641,Sourcing Analytics,Not Available,Not Available,Beginner · Course · 1 - 4 Weeks
642,Big Data Modeling and Management Systems," Big Data, Data Analysis, Data Management, Data Model, Data Structures, Databases, Database Design, Database Application, Database Theory, Leadership and Management",4.4,Mixed · Course · 1 - 3 Months
643,Fundamentals of Database Systems, Databases,4.3,Intermediate · Guided Project · Less Than 2 Hours
644,"Performing Network, Path, and Text Analyses in SAS Visual Analytics"," Business Analysis, Data Analysis, Data Visualization, Interactive Data Visualization, Network Analysis, SAS (Software), Data Analysis Software, Data Structures, Data Visualization Software, Visualization (Computer Graphics)",4.7,Intermediate · Course · 1 - 4 Weeks
645,Social Network Analysis," Network Analysis, Network Architecture, Social Media, Computer Networking, Network Model, General Statistics, Graph Theory, Probability & Statistics",4.7,Beginner · Course · 1 - 3 Months
646,Linear Algebra: Orthogonality and Diagonalization,Not Available,4.9,Intermediate · Course · 1 - 4 Weeks
647,Introduction to the Tidyverse," Data Analysis, Data Management, R Programming, Data Structures, Database Design, Leadership and Management, Programming Principles, Database Theory, Databases, Data Visualization",4.4,Beginner · Course · 1 - 3 Months
648,Bitcoin Price Prediction using Facebook Prophet," Data Visualization, Forecasting, Machine Learning, Python Programming",4.5,Beginner · Guided Project · Less Than 2 Hours
649,Probabilistic Deep Learning with TensorFlow 2," Probability & Statistics, Statistical Analysis, Deep Learning, Tensorflow",4.7,Advanced · Course · 1 - 3 Months
650,Framework for Data Collection and Analysis," Data Analysis, General Statistics, Research and Design, Survey Creation, Big Data, Data Management, Probability & Statistics, Market Analysis, Process Analysis, Scientific Visualization",4.2,Intermediate · Course · 1 - 4 Weeks
651,Serverless Data Processing with Dataflow: Foundations," Cloud Computing, Cloud Platforms, Google Cloud Platform, Apache, Cloud Engineering, Computer Architecture, Distributed Computing Architecture",4.2,Intermediate · Course · 1 - 3 Months
652,Creating Advanced Reports with SAS Visual Analytics," Business Analysis, Data Analysis, Data Visualization, SAS (Software), Statistical Programming, Business Intelligence, Computer Graphics, Data Analysis Software, Data Management, Statistical Visualization",4.7,Intermediate · Course · 1 - 4 Weeks
653,Introduction to Node-red, Javascript,4.8,Beginner · Guided Project · Less Than 2 Hours
654,Explainable AI: Scene Classification and GradCam Visualization," Deep Learning, Computer Vision, Machine Learning, Python Programming",4.7,Intermediate · Guided Project · Less Than 2 Hours
655,Promote the Ethical Use of Data-Driven Technologies," Leadership and Management, Human Learning, Big Data, Computer Programming Tools, Critical Thinking, Decision Making, Machine Learning, Programming Principles, Software Architecture, Theoretical Computer Science",4.7,Beginner · Course · 1 - 3 Months
656,Twitter API: Mining Data using Orange Data Mining Platform," Data Mining, Data Visualization",Not Available,Beginner · Guided Project · Less Than 2 Hours
657,Principal Component Analysis with NumPy," Python Programming, Data Science",4.6,Intermediate · Guided Project · Less Than 2 Hours
658,Calculating Descriptive Statistics in R," Data Analysis, General Statistics, R Programming, Data Science",4.8,Beginner · Guided Project · Less Than 2 Hours
659,Medical Insurance Premium Prediction with Machine Learning," Machine Learning, Data Science, Python Programming",4.6,Beginner · Guided Project · Less Than 2 Hours
660,FIFA20 Data Exploration using Python," Data Visualization, Exploratory Data Analysis",4.5,Beginner · Guided Project · Less Than 2 Hours
661,Data Manipulation and Management using MYSQL Workbench, Data Science,4.4,Beginner · Guided Project · Less Than 2 Hours
